{
  "frente": "Canoas",
  "uf": "RS",
  "servico": "SAMU",
  "estagio": "contratado",
  "score": 8.0,
  "valor_contratual_mensal": 2048134,
  "operador_atual": null,
  "verdict": "go",
  "atualizado_em": "2026-08-04",
  "proximo_passo": "FECHADO — junto com Belém, é a implantação mais próxima. Valor do ESTUDO: R$ 2.048.134/mês no SAMU (CDO 1.316.755, remuneração 7,2%, ~80 CLT, R$ 5,89/hab). ⚠️ ESCOPO A CONFIRMAR: o estudo também precifica a Rede CAPS em R$ 2.405.061 — integrado dá R$ 4.453.196/mês. Se o contrato fechado inclui o CAPS, o pipeline aqui está subdimensionado pela metade. ⚠️ Espaço de desconto estreito (~4%): piso a 4% de remuneração é R$ 1.966.890; abaixo de R$ 1.873.969 é equilíbrio zero — nunca contratar.",
  "populacao": 347657,
  "gatilho": "Estudo produzido: estudos-internos/canoas-rs.md (samais-estudos (main, 03/08/2026))"
}
