{
  "frente": "Paraguai — SEME",
  "uf": "BR",
  "servico": "Consultoria",
  "estagio": "radar",
  "score": 0,
  "valor_contratual_mensal": null,
  "atualizado_em": "2026-07-11",
  "proximo_passo": "Frente internacional — qualificar escopo (SEME) e viabilidade. UF='BR' por convenção do schema (frente fora do padrão UF nacional)."
}
