{
  "frente": "Taboão da Serra",
  "uf": "SP",
  "servico": "SAMU",
  "estagio": "contratado",
  "score": 0,
  "valor_contratual_mensal": null,
  "operador_atual": null,
  "verdict": "go",
  "atualizado_em": "2026-08-04",
  "proximo_passo": "FECHADO e IMINENTE. A levantar antes do dia 1: valor contratual mensal, nº de postos/viaturas, população IBGE. ⚠️ É aqui que nasceu a lição 148 vs 80 — o dimensionamento tem que sair com Fator de Cobertura 4,5, nunca 2,2."
}
